<?xml version="1.0" encoding="UTF-8"?>
<!DOCTYPE employees SYSTEM "ques7.dtd">
<employees>
    <employee>
      <firstname>Roshan</firstname>
      <lastname>Maharjan</lastname>
      <address>Nepal</address>
      <phone>12345</phone>
    </employee>

    <employee>
      <firstname>Ram</firstname>
      <lastname>Maharjan</lastname>
      <address>Nepal</address>
      <phone>12345</phone>
    </employee>

   
</employees>
